{
 "version": "1.0.0",
 "release_kind": [
  "data",
  "tool"
 ],
 "data_source": {
  "name": "RCSR-content (Reticular Chemistry Structure Resource)",
  "commit": "580316c9352b747f5c309a93acd21a3a2b4034a3",
  "files": [
   {
    "path": "public/data/3dall.txt",
    "url": "https://raw.githubusercontent.com/rcsr-net/RCSR-content/580316c9352b747f5c309a93acd21a3a2b4034a3/public/data/3dall.txt",
    "sha256": "c143e8aa98a94fbec9f7ff30571269494b6e42895e2b57b219a40512801d2743",
    "bytes": 4547394,
    "required_for": "all scopes"
   },
   {
    "path": "public/downloads/RCSRnets.arc",
    "url": "https://raw.githubusercontent.com/rcsr-net/RCSR-content/580316c9352b747f5c309a93acd21a3a2b4034a3/public/downloads/RCSRnets.arc",
    "sha256": "8a18b5c2307c0383524a54a74b7499cfa3222a12e23743dd95d6eed07b6ebd6f",
    "bytes": 1754079,
    "required_for": "scope all (--with-arc)"
   }
  ],
  "redistributed": false,
  "licence_found": false
 },
 "kinds": {
  "finite-computation": "checked by the programs in this repository on the user's download; the programs are not formally verified",
  "independent-implementation": "agreement with a separately written implementation on the same pinned input",
  "prose": "argued in README.md, not machine-checked"
 },
 "scope": {
  "human_expert_review": false,
  "formal_proof": false,
  "independent_check_beyond_core": false,
  "statement_about_gnns_in_general": false,
  "radius_equals_gnn_layers": false,
  "models_with_species_or_geometry": false,
  "database_wide_maximum": false,
  "intended_rcsr_geometry": false,
  "rcsr_data_redistributed": false,
  "priority_claimed": false
 },
 "not_claimed": [
  "anything about graph neural networks in general; no model was trained or tested",
  "that a ball radius, or r_WL - r_min, is a number of GNN layers",
  "anything about models that use species, coordinates, distances, angles or periodic labels",
  "a maximum of r_min, r_WL or r_WL - r_min over the RCSR database; the 99 cases are a selection",
  "that the graphs are the structures intended by the RCSR authors, beyond the stated source models",
  "that nets whose balls agree up to some radius are the same net",
  "a new isomorphism algorithm, a new concept, or priority",
  "independent checking of the 93 non-core cases",
  "a complete search for earlier tables of this kind (the Blatov-Proserpio 2009 supplementary files, the ToposPro TTD collections and the later literature were not checked in full)",
  "human expert review"
 ],
 "claims": [
  {
   "id": "core-values-independent",
   "kind": "independent-implementation",
   "cases": 6,
   "statement": "For the six core cases of expected.json, a separately written implementation (Gemmi 0.7.5, NetworkX 3.7, Python standard library) computed the same r_min and r_WL from the same pinned 3dall.txt, and for fly V1 / ylf V1 the same trace(A^10) of the radius-4 balls (closed walks of length 10 summed over all vertices of the ball: 2,816,008 and 2,816,168).",
   "evidence": [
    {
     "path": "expected.json",
     "sha256": "ee395ceeabe33aac4df925f7821cb1d4e3d65d8d48d8939c837215875cb4ee27",
     "bytes": 40457
    },
    {
     "path": "VERIFICATION-RECORD.md",
     "sha256": "65f7b7e72754968350e193cbc08e7872c7d5a57b3c0376603821a8b405bad04c",
     "bytes": 4759
    }
   ],
   "reproduce": "python3 -B suite.py run --work work/core --scope core (this package; the independent code is not included)",
   "qualification": "the independent team shared the definitions, the input and a description of the coordinate handling, but not the code or results; it built tsa/tsg without the ARC file",
   "numbers": {
    "scope": "core"
   }
  },
  {
   "id": "main-values",
   "kind": "finite-computation",
   "cases": 76,
   "statement": "For each case in scope main, on the graphs built from the pinned 3dall.txt under the stated source models: the rooted balls of radius r_min - 1 are isomorphic (complete root-preserving map checked), the balls of radius r_min are not (certificate checked), and stable 1-WL with initial colours (distance from root, degree in ball) first separates the balls at radius r_WL (recomputed at every radius from 1 to r_WL).",
   "evidence": [
    {
     "path": "expected.json",
     "sha256": "ee395ceeabe33aac4df925f7821cb1d4e3d65d8d48d8939c837215875cb4ee27",
     "bytes": 40457
    },
    {
     "path": "suite.py",
     "sha256": "eb6b1a4e0d9a3da9bc29645e72bd5fcdb50a049417ec83d9e2907c8a9e432a65",
     "bytes": 6908
    },
    {
     "path": "verify_run.py",
     "sha256": "f2a3502850fad0f393b038897dca85aa0d9b661258c35c015194804d6fdd01a0",
     "bytes": 8371
    },
    {
     "path": "source_check.py",
     "sha256": "9be2624885300abdac295b2f7c04bd8a6319c44b58fe9c1ccddb02967339726f",
     "bytes": 6500
    },
    {
     "path": "core_check.py",
     "sha256": "ee3d8987f232061204973c064345dadab4f8b36387045dfa2201e0dda3462f26",
     "bytes": 3864
    },
    {
     "path": "finite_check.py",
     "sha256": "babe5fd8ac81e1b61f56d5ed10a6cf6b2441a892fe1784926b207e479026c9e0",
     "bytes": 4500
    }
   ],
   "reproduce": "python3 -B suite.py run --work work/main --scope main",
   "qualification": "outside the six core cases, checked only by this package; the checker does not import the generator but shares source_io.py (input handling, record parser, source-model definitions) with it and was written by the same team",
   "numbers": {
    "scope": "main",
    "r_WL_greater_than_r_min": 74
   }
  },
  {
   "id": "all-values",
   "kind": "finite-computation",
   "cases": 99,
   "statement": "The same statement as main-values holds for all 99 cases of expected.json when the optional RCSRnets.arc is supplied for nets whose coordinates do not give a graph under the source models. In 97 cases r_WL > r_min; the largest difference r_WL - r_min among the 99 is 4 (tsa V1 / tsg V3, r_min = 4, r_WL = 8).",
   "evidence": [
    {
     "path": "expected.json",
     "sha256": "ee395ceeabe33aac4df925f7821cb1d4e3d65d8d48d8939c837215875cb4ee27",
     "bytes": 40457
    },
    {
     "path": "suite.py",
     "sha256": "eb6b1a4e0d9a3da9bc29645e72bd5fcdb50a049417ec83d9e2907c8a9e432a65",
     "bytes": 6908
    },
    {
     "path": "verify_run.py",
     "sha256": "f2a3502850fad0f393b038897dca85aa0d9b661258c35c015194804d6fdd01a0",
     "bytes": 8371
    },
    {
     "path": "source_check.py",
     "sha256": "9be2624885300abdac295b2f7c04bd8a6319c44b58fe9c1ccddb02967339726f",
     "bytes": 6500
    },
    {
     "path": "core_check.py",
     "sha256": "ee3d8987f232061204973c064345dadab4f8b36387045dfa2201e0dda3462f26",
     "bytes": 3864
    },
    {
     "path": "finite_check.py",
     "sha256": "babe5fd8ac81e1b61f56d5ed10a6cf6b2441a892fe1784926b207e479026c9e0",
     "bytes": 4500
    }
   ],
   "reproduce": "python3 -B suite.py run --work work/all --scope all --with-arc",
   "qualification": "graphs from the ARC file are matched to the 3dall.txt record by net name and weighted 10-shell coordination sequences; an RCSR orbit is a root only if its 10-shell sequence is unique in the record, and the root is the first ARC vertex with that sequence, which is assumed, not proved, to lie in that orbit; 10 of the 99 cases used such a graph in our runs; this scope is not run in CI",
   "numbers": {
    "scope": "all",
    "r_WL_greater_than_r_min": 97,
    "largest_difference": 4
   }
  },
  {
   "id": "checker-rejects-corruption",
   "kind": "finite-computation",
   "cases": 6,
   "statement": "selftest.py runs 15 tests against a verified core work folder. Twelve are rejection tests: corrupted input bytes, graph, isomorphism, walk count, WL sequence, schema and expected values, a removed certificate, a missing branch of a refutation tree (on two small hand-made graphs), a time limit, a simulated memory error, and a report path that would overwrite the input are each rejected with the documented exit code. Three runs must pass: a re-check of the core folder, a run without network from a local file, and a run of scope main from a copy of only the manifest files.",
   "evidence": [
    {
     "path": "selftest.py",
     "sha256": "ab0689e105273636ed3b78807c93e942bbd1a46b854b80101c4699d5d0f4abc8",
     "bytes": 7145
    },
    {
     "path": "manifest.json",
     "sha256": "9f74a45ab07ae251d433fbb0b3ed6b90b71e8013e338434e2ae4119419e73771",
     "bytes": 2098
    }
   ],
   "reproduce": "python3 -B selftest.py --verified-work work/core --out work/selftest",
   "qualification": "tests written by the same team as the checker; they find faults in the code, they do not establish independence",
   "numbers": {
    "scope": "core",
    "tests": 15
   }
  },
  {
   "id": "wl-initial-colours",
   "kind": "prose",
   "statement": "On a rooted ball, 1-WL started from (distance from root, degree in ball) and 1-WL started with only the root coloured reach the same stable partition, so the independent check (root only) and this package measure the same r_WL.",
   "evidence": [
    {
     "path": "README.md",
     "sha256": "77a5cc7ae7fff57d99fbcb36fe43579ad976dcac8d90e0f91445b732464dd1bc",
     "bytes": 14729
    }
   ],
   "reproduce": "not machine-checked; the independent team also ran both initialisations for ben/cat, tsa/tsg and acl/nih and found the same results"
  }
 ]
}
